timestamp,label,mean,stddev,mean_plus_minus,seed_range,seed_count,lab_config_hash_SHA-256,lab_config_path,logfile,notes
2025-12-29T10:04:41Z,L1 - Baseline (pre-Optuna),0.75150,0.09534,0.75150 +/- 0.09534,1-100,100,6117999c430b982d,corasat\lab_configs\L1_BeforeFirstOptunaOptimization,corasat\\logs\\simulation_2025-12-28_173.log,baseline pre-optuna
2026-01-01T01:57:55Z,L2 - Reduced context (Optuna 1),0.88692,0.08530,0.88692 +/- 0.08530,1-100,100,e1a0a6c29123bc6b,corasat\lab_configs\L2_AfterFirstOptunaOptimization_ReducedContext,corasat\logs\simulation_2026-01-01_01.log,Optuna continuation validated over seeds 1-100.
2026-01-01T10:32:30Z,L3 - Full context (L2 optuna params),0.89746,0.07993,0.89746 +/- 0.07993,1-100,100,06211edd6ffa8cbf,corasat\lab_configs\L3_AfterFirstOptunaOptimization,corasat\logs\simulation_2026-01-01_02.log,full context using L2 optuna parameters; L3 rules/Drone_Support
2026-01-02T04:10:24Z,L4 - Optuna tuning of L3 (full context),0.90348,0.09550,0.90348 +/- 0.09550,1-100,100,3dea4dc1ab991d65,corasat\lab_configs\L4_OptunaTuning_L3,corasat\logs\simulation_2026-01-01_58.log,L3 baseline tuned via Optuna (seed 1).
2026-01-03T01:11:20Z,L5 - LoRA fine-tuned (from L4),0.84842,0.13484,0.84842 +/- 0.13484,1-100,100,a87b1c23521b0250,corasat\lab_configs\L5_LoRA_L4,corasat\logs\simulation_2026-01-02_01.log,LoRA fine-tune (corasat-l4-lora Q8_0)
2026-01-19T19:06:22.408667+01:00,L6 - Deepseek baseline (L2 config),0.88708,0.08573,0.88708 +/- 0.08573,1-100,100,7fb31ecbb647d5ab,corasat\lab_configs\20260119-190622_L6-DeepseekbaselineL2config,corasat\logs\simulation_2026-01-18_01.log,deepseek-r1:32b with L2 reduced-context config; watchdog 15 min.
2026-01-26T06:49:07.660220+01:00,L0 - Rules-only (no decision-support scoring),0.14937,0.07641,0.14937 +/- 0.07641,1-100,100,29ebb5576264e51d,corasat\lab_configs\20260126-064907_L0-Rules-onlynodecision-supports,corasat\logs\simulation_2026-01-25_07.log,rules-only baseline; decision-support scoring tables/summary omitted
